{
  "schemaVersion": "1.0",
  "generatedAt": "2026-08-19T04:21:56Z",
  "runId": "_bootstrap-2026-08-19T04-21-54Z",
  "platform": {
    "os": "win32 10.0.26200",
    "architecture": "x64",
    "shell": "powershell/cmd"
  },
  "tools": [
    {
      "id": "git",
      "status": "AVAILABLE",
      "classification": "REQUIRED",
      "version": "2.53.0",
      "executable": "C:\\Program Files\\Git\\cmd\\git.exe",
      "scope": "EXISTING_APPROVED",
      "source": "resolved on PATH; approved existing installation",
      "capabilities": [
        "repository-version-control",
        "create-git-worktree",
        "generate-diff"
      ],
      "selectionReason": "resolved on PATH; approved existing installation",
      "validation": {
        "versionCheck": "PASSED",
        "smokeTest": "PASSED",
        "validatedAt": "2026-08-19T04:21:55Z"
      }
    },
    {
      "id": "dotnet-sdk",
      "status": "AVAILABLE",
      "classification": "REQUIRED_IF_APPLICABLE",
      "version": "10.0.400",
      "executable": "C:\\Program Files\\dotnet\\dotnet.exe",
      "scope": "EXISTING_APPROVED",
      "source": "resolved on PATH; approved existing installation",
      "capabilities": [
        "restore-nuget-dependency-graph",
        "build-dotnet",
        "test-dotnet",
        "run-local-dotnet-tools",
        "acquire-nuget-package"
      ],
      "selectionReason": "resolved on PATH; approved existing installation",
      "validation": {
        "versionCheck": "PASSED",
        "smokeTest": "PASSED",
        "validatedAt": "2026-08-19T04:21:55Z"
      }
    },
    {
      "id": "node",
      "status": "AVAILABLE",
      "classification": "REQUIRED",
      "version": "14.20.0",
      "executable": "C:\\Program Files\\nodejs\\node.exe",
      "scope": "EXISTING_APPROVED",
      "source": "resolved on PATH; approved existing installation",
      "capabilities": [
        "validate-json-schema"
      ],
      "selectionReason": "resolved on PATH; approved existing installation",
      "validation": {
        "versionCheck": "PASSED",
        "smokeTest": "PASSED",
        "validatedAt": "2026-08-19T04:21:56Z"
      }
    },
    {
      "id": "npm",
      "status": "NOT_APPLICABLE",
      "classification": "REQUIRED_IF_APPLICABLE",
      "version": null,
      "executable": null,
      "scope": null,
      "source": "appliesWhen not satisfied by repository evidence",
      "capabilities": [
        "inspect-npm-registry-metadata",
        "acquire-npm-package",
        "compare-npm-package-content",
        "install-isolated-npm-dependencies"
      ],
      "selectionReason": "appliesWhen not satisfied by repository evidence",
      "validation": {
        "versionCheck": "NOT_APPLICABLE",
        "smokeTest": "SKIPPED",
        "validatedAt": "2026-08-19T04:21:56Z"
      }
    },
    {
      "id": "tar",
      "status": "AVAILABLE",
      "classification": "RECOMMENDED",
      "version": "3.8.4",
      "executable": "C:\\Windows\\System32\\tar.exe",
      "scope": "EXISTING_APPROVED",
      "source": "resolved on PATH; approved existing installation",
      "capabilities": [
        "extract-archive"
      ],
      "selectionReason": "resolved on PATH; approved existing installation",
      "validation": {
        "versionCheck": "PASSED",
        "smokeTest": "PASSED",
        "validatedAt": "2026-08-19T04:21:56Z"
      }
    },
    {
      "id": "ripgrep",
      "status": "MISSING",
      "classification": "RECOMMENDED",
      "version": null,
      "executable": null,
      "scope": null,
      "source": "not found; fallback available: git-grep-or-findstr",
      "capabilities": [
        "search-repository"
      ],
      "selectionReason": "not found; fallback available: git-grep-or-findstr",
      "validation": {
        "versionCheck": "SKIPPED",
        "smokeTest": "SKIPPED",
        "validatedAt": "2026-08-19T04:21:56Z"
      }
    },
    {
      "id": "docker",
      "status": "NOT_APPLICABLE",
      "classification": "OPTIONAL",
      "version": null,
      "executable": null,
      "scope": null,
      "source": "appliesWhen not satisfied by repository evidence",
      "capabilities": [
        "container-isolation"
      ],
      "selectionReason": "appliesWhen not satisfied by repository evidence",
      "validation": {
        "versionCheck": "NOT_APPLICABLE",
        "smokeTest": "SKIPPED",
        "validatedAt": "2026-08-19T04:21:56Z"
      }
    },
    {
      "id": "dotnet-apicompat",
      "status": "NOT_APPLICABLE",
      "classification": "REQUIRED_IF_APPLICABLE",
      "version": null,
      "executable": null,
      "scope": null,
      "source": "appliesWhen not satisfied by repository evidence",
      "capabilities": [
        "compare-dotnet-public-api"
      ],
      "selectionReason": "appliesWhen not satisfied by repository evidence",
      "validation": {
        "versionCheck": "NOT_APPLICABLE",
        "smokeTest": "SKIPPED",
        "validatedAt": "2026-08-19T04:21:56Z"
      }
    },
    {
      "id": "ilspycmd",
      "status": "NOT_APPLICABLE",
      "classification": "REQUIRED_IF_APPLICABLE",
      "version": null,
      "executable": null,
      "scope": null,
      "source": "appliesWhen not satisfied by repository evidence",
      "capabilities": [
        "inspect-dotnet-assembly-metadata",
        "selectively-decompile-dotnet"
      ],
      "selectionReason": "appliesWhen not satisfied by repository evidence",
      "validation": {
        "versionCheck": "NOT_APPLICABLE",
        "smokeTest": "SKIPPED",
        "validatedAt": "2026-08-19T04:21:56Z"
      }
    },
    {
      "id": "typescript",
      "status": "NOT_APPLICABLE",
      "classification": "REQUIRED_IF_APPLICABLE",
      "version": null,
      "executable": null,
      "scope": null,
      "source": "appliesWhen not satisfied by repository evidence",
      "capabilities": [
        "typecheck-typescript",
        "scan-typescript-symbols"
      ],
      "selectionReason": "appliesWhen not satisfied by repository evidence",
      "validation": {
        "versionCheck": "NOT_APPLICABLE",
        "smokeTest": "SKIPPED",
        "validatedAt": "2026-08-19T04:21:56Z"
      }
    },
    {
      "id": "angular-cli",
      "status": "NOT_APPLICABLE",
      "classification": "REQUIRED_IF_APPLICABLE",
      "version": null,
      "executable": null,
      "scope": null,
      "source": "appliesWhen not satisfied by repository evidence",
      "capabilities": [
        "inspect-angular-workspace",
        "run-angular-build"
      ],
      "selectionReason": "appliesWhen not satisfied by repository evidence",
      "validation": {
        "versionCheck": "NOT_APPLICABLE",
        "smokeTest": "SKIPPED",
        "validatedAt": "2026-08-19T04:21:56Z"
      }
    }
  ],
  "missingRequiredCapabilities": [],
  "warnings": [
    "recommended tool 'ripgrep' is missing (fallback: git-grep-or-findstr)"
  ]
}